{
  "$schema": "https://spec.docuccino.app/uir/1.0/schema.json",
  "uir": "1.0.0",
  "openapi": "3.2.0",
  "info": { "title": "Billing API", "version": "1.4.0" },
  "paths": {
    "/api/invoices": {
      "get": {
        "x-docuccino": { "id": "op:v1:aaaainvoiceindex" },
        "summary": "List invoices.",
        "parameters": [
          {
            "x-docuccino": { "id": "par:v1:aaaapage" },
            "name": "page",
            "in": "query",
            "schema": {
              "x-docuccino": {
                "provenance": [
                  { "producer": "integration:query-builder", "layer": "integration", "fields": ["type"],
                    "source": { "file": "app/Queries/InvoiceQuery.php", "line": 18, "symbol": "App\\Queries\\InvoiceQuery::paginate" } }
                ]
              },
              "type": "integer",
              "minimum": 1
            }
          },
          {
            "x-docuccino": { "id": "par:v1:aaaasort" },
            "name": "sort",
            "in": "query",
            "schema": { "type": "array", "items": { "type": "string", "enum": ["total", "-total"] } }
          },
          {
            "x-docuccino": { "id": "par:v1:aaaatenant" },
            "name": "X-Tenant",
            "in": "header",
            "required": true,
            "schema": { "type": "string" }
          }
        ],
        "responses": {
          "200": {
            "x-docuccino": { "id": "res:v1:aaaainvoicelist" },
            "description": "OK",
            "content": {
              "application/json": {
                "schema": {
                  "x-docuccino": {
                    "provenance": [
                      { "producer": "inference", "layer": "inference", "fields": ["items", "type"], "confidence": 0.9 }
                    ]
                  },
                  "type": "array",
                  "items": { "$ref": "#/components/schemas/Invoice" }
                },
                "example": [{ "total": 12.5, "reference": "INV-1", "lines": [] }]
              }
            }
          }
        }
      },
      "post": {
        "x-docuccino": { "id": "op:v1:aaaainvoicestore" },
        "requestBody": {
          "required": true,
          "content": {
            "application/json": {
              "schema": { "$ref": "#/components/schemas/InvoiceDraft" }
            }
          }
        },
        "responses": {
          "201": {
            "x-docuccino": { "id": "res:v1:aaaainvoicemade" },
            "description": "Created",
            "headers": {
              "Location": {
                "required": true,
                "description": "Where the new invoice lives.",
                "schema": {
                  "x-docuccino": {
                    "provenance": [
                      { "producer": "integration:redirect", "layer": "integration", "fields": ["type"],
                        "source": { "file": "app/Http/Controllers/InvoiceController.php", "line": 44, "symbol": "App\\Http\\Controllers\\InvoiceController::store" } }
                    ]
                  },
                  "type": "string"
                }
              },
              "X-RateLimit-Remaining": { "schema": { "type": "integer", "minimum": 0 }, "example": 4 },
              "X-Chunk": { "schema": { "type": "integer" } },
              "Content-Type": { "schema": { "type": "integer" } },
              "X-Signature": { "content": { "application/jose": { "schema": { "type": "string" } } } },
              "X-Legacy": { "$ref": "#/components/headers/Legacy" }
            },
            "content": { "application/json": { "schema": { "$ref": "#/components/schemas/Invoice" } } }
          },
          "4XX": {
            "x-docuccino": { "id": "res:v1:aaaainvoicebad" },
            "description": "Invalid",
            "content": { "application/problem+json": { "schema": { "$ref": "#/components/schemas/Problem" } } }
          }
        }
      }
    },
    "/api/invoices/recent": {
      "get": {
        "x-docuccino": { "id": "op:v1:aaaainvoicerecent" },
        "responses": {
          "200": {
            "description": "OK",
            "content": { "application/json": { "schema": { "type": "array", "items": { "$ref": "#/components/schemas/Invoice" } } } }
          }
        }
      }
    },
    "/api/invoices/{invoice}": {
      "parameters": [
        {
          "x-docuccino": { "id": "par:v1:aaaainvoiceid" },
          "name": "invoice",
          "in": "path",
          "required": true,
          "schema": { "type": "integer" }
        }
      ],
      "get": {
        "x-docuccino": { "id": "op:v1:aaaainvoiceshow" },
        "responses": {
          "200": {
            "x-docuccino": { "id": "res:v1:aaaainvoiceone" },
            "description": "OK",
            "content": { "application/json": { "schema": { "$ref": "#/components/schemas/Invoice" } } }
          },
          "default": {
            "description": "Error",
            "content": { "application/problem+json": { "schema": { "$ref": "#/components/schemas/Problem" } } }
          }
        }
      },
      "delete": {
        "x-docuccino": { "id": "op:v1:aaaainvoicekill" },
        "responses": { "204": { "description": "No content" } }
      }
    },
    "/api/exports": {
      "get": {
        "x-docuccino": { "id": "op:v1:aaaaexportsfeed" },
        "responses": {
          "200": {
            "description": "OK",
            "content": { "text/csv": { "schema": { "type": "string" } } }
          }
        }
      }
    }
  },
  "components": {
    "headers": {
      "Legacy": { "description": "Sent while the old client is still out there.", "schema": { "type": "boolean" } }
    },
    "schemas": {
      "Invoice": {
        "x-docuccino": {
          "id": "sch:v1:aaaainvoiceshape",
          "provenance": [
            { "producer": "integration:eloquent", "layer": "integration", "fields": ["properties"],
              "source": { "file": "app/Models/Invoice.php", "line": 22, "symbol": "App\\Models\\Invoice" } }
          ]
        },
        "type": "object",
        "properties": {
          "reference": { "type": "string" },
          "total": {
            "x-docuccino": {
              "provenance": [
                { "producer": "integration:eloquent", "layer": "integration", "fields": ["type"],
                  "source": { "file": "app/Models/Invoice.php", "line": 31, "symbol": "App\\Models\\Invoice::$total" } }
              ]
            },
            "type": "number"
          },
          "lines": { "type": "array", "items": { "$ref": "#/components/schemas/Line" } }
        },
        "required": ["reference", "total"]
      },
      "Line": {
        "x-docuccino": { "id": "sch:v1:aaaalineshape" },
        "type": "object",
        "properties": {
          "quantity": { "type": "integer", "example": 3 },
          "child": { "$ref": "#/components/schemas/Line" }
        },
        "required": ["quantity"]
      },
      "InvoiceDraft": {
        "x-docuccino": {
          "id": "sch:v1:aaaadraftshape",
          "provenance": [
            { "producer": "integration:form-request", "layer": "integration", "fields": ["properties"],
              "source": { "file": "app/Http/Requests/StoreInvoice.php", "line": 14, "symbol": "App\\Http\\Requests\\StoreInvoice::rules" } }
          ]
        },
        "type": "object",
        "properties": { "reference": { "type": "string", "minLength": 3 } },
        "required": ["reference"]
      },
      "Problem": {
        "x-docuccino": { "id": "sch:v1:aaaaproblemshape" },
        "type": "object",
        "properties": { "detail": { "type": "string" } },
        "required": ["detail"]
      }
    }
  }
}
