{
  "$schema": "https://spec.docuccino.app/uir/1.0/schema.json",
  "uir": "1.0.0",
  "openapi": "3.2.0",
  "jsonSchemaDialect": "https://spec.openapis.org/oas/3.2/dialect/base",
  "info": {
    "title": "Forms API",
    "version": "1.0.0"
  },
  "tags": [
    { "name": "Forms", "description": "Form management" }
  ],
  "paths": {
    "/api/v1/forms": {
      "get": {
        "x-uir": {
          "id": "op:v1:mfz3q8k2w9r7t1ua",
          "provenance": [
            {
              "producer": "inference",
              "layer": "inference",
              "fields": ["responses.200"],
              "source": { "file": "modules/Form/Http/Controllers/FormController.php", "line": 38, "symbol": "FormController::index" },
              "confidence": 0.95
            },
            {
              "producer": "attribute",
              "layer": "attribute",
              "fields": ["summary"],
              "source": { "file": "modules/Form/Http/Controllers/FormController.php", "line": 34 },
              "confidence": 1.0,
              "overrode": [
                { "field": "summary", "value": "Index forms", "producer": "docblock" }
              ]
            }
          ]
        },
        "operationId": "forms.index",
        "summary": "List forms",
        "tags": ["Forms"],
        "parameters": [
          {
            "x-uir": {
              "id": "par:v1:ab12cd34ef56ab78",
              "provenance": [
                {
                  "producer": "integration:spatie-query-builder",
                  "layer": "integration",
                  "fields": ["*"],
                  "source": { "file": "modules/Form/Queries/FormIndexQuery.php", "line": 22 },
                  "confidence": 0.9
                }
              ]
            },
            "name": "filter[status]",
            "in": "query",
            "required": false,
            "schema": {
              "type": "string",
              "enum": ["draft", "published", "archived"],
              "x-enumDescriptions": { "draft": "Not yet visible", "published": "Live", "archived": "Read-only" }
            }
          },
          {
            "x-uir": { "id": "par:v1:77aa88bb99cc00dd" },
            "name": "per_page",
            "in": "query",
            "required": false,
            "schema": {
              "type": "integer",
              "default": 15,
              "minimum": 1,
              "maximum": 100,
              "x-uir": { "mock": { "faker": "numberBetween:1,100" } }
            }
          }
        ],
        "responses": {
          "200": {
            "x-uir": { "id": "res:v1:e1f2a3b4c5d6e7f8" },
            "description": "Paginated list of forms",
            "content": {
              "application/json": {
                "schema": { "$ref": "#/components/schemas/PaginatedFormData" }
              }
            }
          },
          "401": { "$ref": "#/components/responses/ProblemUnauthenticated" },
          "422": { "$ref": "#/components/responses/ProblemValidation" }
        }
      }
    }
  },
  "components": {
    "schemas": {
      "PaginatedFormData": {
        "type": "object",
        "properties": {
          "data": { "type": "array", "items": { "$ref": "#/components/schemas/FormData" } }
        }
      },
      "FormData": {
        "type": "object",
        "properties": {
          "id": { "type": "integer" },
          "title": { "type": "string" }
        }
      }
    },
    "responses": {
      "ProblemUnauthenticated": {
        "description": "Unauthenticated",
        "content": {
          "application/problem+json": { "schema": { "type": "object" } }
        }
      },
      "ProblemValidation": {
        "description": "Validation failed",
        "content": {
          "application/problem+json": { "schema": { "type": "object" } }
        }
      }
    }
  },
  "x-uir": {
    "document": { "id": "doc:default", "configHash": "cfg-abc", "contentHash": "will-be-recomputed" },
    "generator": { "name": "docuccino/laravel", "version": "0.1.0", "specVersion": "1.0.0" }
  }
}
